{
  "passport_id": "550e8400-e29b-41d4-a716-446655440001",
  "kind": "template",
  "spec_version": "oap/1.0",
  "owner_id": "org_12345678",
  "owner_type": "org",
  "assurance_level": "L1",
  "status": "active",
  "capabilities": [
    {
      "id": "data.export"
    }
  ],
  "limits": {
    "data.export": {
      "max_rows": 100000,
      "allow_pii": false,
      "allowed_collections": ["users", "orders", "products", "analytics"]
    }
  },
  "regions": ["US", "CA", "EU"],
  "metadata": {
    "name": "Data Analytics AI",
    "description": "AI agent for data analytics operations"
  },
  "created_at": "2024-01-01T00:00:00Z",
  "updated_at": "2024-01-15T10:30:00Z",
  "version": "1.0.0"
}
